{
  "basics": {
    "name": "Jordan Rivera",
    "label": "Backend Engineer",
    "profiles": [
      {
        "network": "GitHub",
        "username": "jrivera",
        "url": "https://github.com/jrivera"
      }
    ]
  },
  "work": [
    {
      "name": "Northwind Payments",
      "position": "Senior Software Engineer",
      "startDate": "2023-01",
      "highlights": [],
      "x-sources": [
        "resume:/work/0"
      ]
    },
    {
      "name": "Tailspin Toys",
      "position": "Software Engineer",
      "startDate": "2019-06",
      "endDate": "2022-12",
      "highlights": [
        "Migrated the order service from PHP to Go, serving 2M requests per day"
      ],
      "x-sources": [
        "resume:/work/1"
      ]
    }
  ],
  "projects": [
    {
      "name": "ledger-lint",
      "url": "https://github.com/jrivera/ledger-lint",
      "startDate": "2021-04",
      "description": "Open-source linter for double-entry ledger files; 300 GitHub stars",
      "x-sources": [
        "resume:/projects/0"
      ]
    }
  ],
  "education": [
    {
      "institution": "State University",
      "studyType": "BS",
      "area": "Computer Science",
      "endDate": "2019",
      "x-sources": [
        "resume:/education/0"
      ]
    }
  ],
  "skills": [
    {
      "name": "Backend",
      "keywords": [
        "Go",
        "Python",
        "Redis",
        "PostgreSQL"
      ]
    }
  ]
}
